{
  "$schema":"https://json-schema.org/draft/2020-12/schema","$id":"content-production-run-v1","type":"object","additionalProperties":true,
  "required":["schemaVersion","runVersion","runId","mode","publicationPolicy","status","startedAt","updatedAt","baseSha","currentBaseSha","attempt","previousAttempts","mainHeadAtStart","publishedIdsAtStart","targetStrainIds","expectedPublicationDelta","items"],
  "properties":{
    "schemaVersion":{"const":1},"runVersion":{"const":1},"runId":{"type":"string","minLength":1},"mode":{"enum":["new-publication","image-replacement"]},"publicationPolicy":{"enum":["batch","cultivar"]},
    "status":{"enum":["ACTIVE","WAITING_REPAIR","PUBLISHING","SUCCESS","CANCELLED","ABORTED_CONCURRENT_UPDATE","FAILED_AUDIT"]},
    "startedAt":{"type":"string"},"updatedAt":{"type":"string"},"finishedAt":{"type":["string","null"]},"cancelledAt":{"type":["string","null"]},
    "baseSha":{"type":"string"},"currentBaseSha":{"type":"string"},"attempt":{"type":"integer","minimum":1},"previousAttempts":{"type":"array"},"mainHeadAtStart":{"type":"string"},"mainHeadAtEnd":{"type":["string","null"]},
    "publishedIdsAtStart":{"type":"array","items":{"type":"string"},"uniqueItems":true},"targetStrainIds":{"type":"array","items":{"type":"string"},"uniqueItems":true},"expectedPublicationDelta":{"type":"array","items":{"type":"string"},"uniqueItems":true},
    "items":{"type":"array","items":{"type":"object","additionalProperties":true,"required":["strainId","sourceStockPath","sourceStockBlobSha","productionStrainPath","publicationEntryId","productionPhase","previousStablePhase","manifestId","manifestRevision","promotedAt","approval","commits","audit"],"properties":{"strainId":{"type":"string"},"sourceStockPath":{"type":["string","null"]},"sourceStockBlobSha":{"type":["string","null"]},"productionStrainPath":{"type":"string"},"publicationEntryId":{"type":"string"},"productionPhase":{"enum":["STOCKED","DATA_READY","IMAGE_PENDING","IMAGE_READY","VISUAL_LINKED","PUBLISHED","NEEDS_REVIEW","ABORTED_CONCURRENT_UPDATE"]},"previousStablePhase":{"type":["string","null"]},"manifestId":{"type":["string","null"]},"manifestRevision":{"type":["integer","null"]},"promotedAt":{"type":["string","null"]},"promotionCommit":{"type":["string","null"]},"approval":{"type":["object","null"]},"commits":{"type":"object","required":["dataCommit","imageInboxCommit","imageProcessingCommit","visualsCommit","publicationCommit","buildCommit"],"properties":{"dataCommit":{"type":["string","null"]},"imageInboxCommit":{"type":["string","null"]},"imageProcessingCommit":{"type":["string","null"]},"visualsCommit":{"type":["string","null"]},"publicationCommit":{"type":["string","null"]},"buildCommit":{"type":["string","null"]}}},"audit":{"type":"array"}}}},
    "pagesDeploymentRunId":{"type":["string","number","null"]},"pagesDeploymentUrl":{"type":["string","null"]},"displayVerifiedAt":{"type":["string","null"]},"publicationSetAtEnd":{"type":["array","null"],"items":{"type":"string"}},"recovery":{"type":["object","null"]},"auditSummary":{"type":["object","null"]}
  }
}
