{"schemaVersion":1,"runVersion":1,"runId":"content-production-20260818T060700Z-01","mode":"new-publication","publicationPolicy":"batch","status":"ACTIVE","startedAt":"2026-08-18T06:07:00Z","updatedAt":"2026-08-18T06:07:00Z","finishedAt":null,"cancelledAt":null,"baseSha":"12addf42ff7ea42bce60587bd3b57f5000d88a3e","currentBaseSha":"12addf42ff7ea42bce60587bd3b57f5000d88a3e","attempt":1,"previousAttempts":[],"mainHeadAtStart":"c07a07d871613bba72efa3518a2d6604d52431aa","mainHeadAtEnd":null,"publishedIdsAtStart":["bubble-gum","california-octane","cataract-kush","chocolope-256","dr-grinspoon","frisian-duck","malawi","og-kush","panama","shaman","strawberry-banana-s1","super-lemon-haze","the-og-18","wedding-cake","wedding-cake-s1","zamaldelica"],"targetStrainIds":["durban-poison","kali-mist","warlock"],"expectedPublicationDelta":["durban-poison","kali-mist","warlock"],"items":[{"strainId":"durban-poison","sourceStockPath":"stock/items/durban-poison.json","sourceStockBlobSha":"8cb7cccdbc5b3e58bb187612335368df10b33103","productionStrainPath":"strains/durban-poison/strain.json","publicationEntryId":"durban-poison","productionPhase":"IMAGE_PENDING","previousStablePhase":"IMAGE_PENDING","manifestId":"content-production-20260818T060700Z-01-durban-poison-image","manifestRevision":1,"promotedAt":"2026-08-18T06:07:00Z","promotionCommit":null,"approval":null,"commits":{"dataCommit":null,"imageInboxCommit":null,"imageProcessingCommit":null,"visualsCommit":null,"publicationCommit":null,"buildCommit":null},"audit":[{"severity":"INFO","code":"PHASE_TRANSITION","fromPhase":"STOCKED","toPhase":"DATA_READY","at":"2026-08-18T06:07:00Z"},{"severity":"INFO","code":"PHASE_TRANSITION","fromPhase":"DATA_READY","toPhase":"IMAGE_PENDING","at":"2026-08-18T06:07:00Z"}]},{"strainId":"kali-mist","sourceStockPath":"stock/items/kali-mist.json","sourceStockBlobSha":"c01ddb9abe1d8d23726ad5cf1d66946244719637","productionStrainPath":"strains/kali-mist/strain.json","publicationEntryId":"kali-mist","productionPhase":"IMAGE_PENDING","previousStablePhase":"IMAGE_PENDING","manifestId":"content-production-20260818T060700Z-01-kali-mist-image","manifestRevision":1,"promotedAt":"2026-08-18T06:07:00Z","promotionCommit":null,"approval":null,"commits":{"dataCommit":null,"imageInboxCommit":null,"imageProcessingCommit":null,"visualsCommit":null,"publicationCommit":null,"buildCommit":null},"audit":[{"severity":"INFO","code":"PHASE_TRANSITION","fromPhase":"STOCKED","toPhase":"DATA_READY","at":"2026-08-18T06:07:00Z"},{"severity":"INFO","code":"PHASE_TRANSITION","fromPhase":"DATA_READY","toPhase":"IMAGE_PENDING","at":"2026-08-18T06:07:00Z"}]},{"strainId":"warlock","sourceStockPath":"stock/items/warlock.json","sourceStockBlobSha":"d0741cccbfd2b6fc9bd9a9046c0ffa2dfe1d772e","productionStrainPath":"strains/warlock/strain.json","publicationEntryId":"warlock","productionPhase":"IMAGE_PENDING","previousStablePhase":"IMAGE_PENDING","manifestId":"content-production-20260818T060700Z-01-warlock-image","manifestRevision":1,"promotedAt":"2026-08-18T06:07:00Z","promotionCommit":null,"approval":null,"commits":{"dataCommit":null,"imageInboxCommit":null,"imageProcessingCommit":null,"visualsCommit":null,"publicationCommit":null,"buildCommit":null},"audit":[{"severity":"INFO","code":"PHASE_TRANSITION","fromPhase":"STOCKED","toPhase":"DATA_READY","at":"2026-08-18T06:07:00Z"},{"severity":"INFO","code":"PHASE_TRANSITION","fromPhase":"DATA_READY","toPhase":"IMAGE_PENDING","at":"2026-08-18T06:07:00Z"}]}],"pagesDeploymentRunId":null,"pagesDeploymentUrl":null,"displayVerifiedAt":null,"publicationSetAtEnd":null,"recovery":null,"auditSummary":{"status":"PREWRITE_PASS","errors":0,"warnings":0,"info":4,"checkedAt":"2026-08-18T06:07:00Z","notes":["Base repository dry-run GO inherited only as prior evidence; current remote rechecked for HEAD, active RUN, Inbox, candidate schema, source/entity closure, and publication set.","Bangi Haze excluded: breeding.generation F8 is not accepted by current MASTER validator.","IMAGE_PENDING with visuals=[] is permitted by current audit visual phase gates.","No image generation, Inbox write, visual linking, publication open, runtime edit, or main write performed."]}}
