{
  "schemaVersion": 1,
  "runVersion": 1,
  "runId": "content-production-start-32223471114",
  "mode": "new-publication",
  "publicationPolicy": "cultivar",
  "status": "ACTIVE",
  "startedAt": "2026-08-19T06:27:40Z",
  "updatedAt": "2026-08-19T06:27:40Z",
  "finishedAt": null,
  "cancelledAt": null,
  "baseSha": "684f1d9fb9beeee5349c5d18f7f147622a020787",
  "currentBaseSha": "684f1d9fb9beeee5349c5d18f7f147622a020787",
  "attempt": 1,
  "previousAttempts": [],
  "mainHeadAtStart": "77fdfa08f9263cb4beede48397cfd31a022b934a",
  "mainHeadAtEnd": null,
  "publishedIdsAtStart": [
    "bubble-gum",
    "california-octane",
    "cataract-kush",
    "chocolope-256",
    "dr-grinspoon",
    "durban-poison",
    "frisian-duck",
    "kali-mist",
    "malawi",
    "og-kush",
    "panama",
    "shaman",
    "strawberry-banana-s1",
    "super-lemon-haze",
    "the-og-18",
    "warlock",
    "wedding-cake",
    "wedding-cake-s1",
    "zamaldelica"
  ],
  "targetStrainIds": [
    "bangi-haze"
  ],
  "expectedPublicationDelta": [
    "bangi-haze"
  ],
  "items": [
    {
      "strainId": "bangi-haze",
      "sourceStockPath": "stock/items/bangi-haze.json",
      "sourceStockBlobSha": "b81c542ddd3bf2f04a6f1dce76888a304db0d8d5",
      "productionStrainPath": "strains/bangi-haze/strain.json",
      "publicationEntryId": "bangi-haze",
      "productionPhase": "IMAGE_PENDING",
      "previousStablePhase": "IMAGE_PENDING",
      "manifestId": "content-production-start-32223471114-bangi-haze-image",
      "manifestRevision": 1,
      "promotedAt": "2026-08-19T06:27:40Z",
      "promotionCommit": null,
      "approval": null,
      "commits": {
        "dataCommit": null,
        "imageInboxCommit": null,
        "imageProcessingCommit": null,
        "visualsCommit": null,
        "publicationCommit": null,
        "buildCommit": null
      },
      "audit": [
        {
          "severity": "INFO",
          "code": "PHASE_TRANSITION",
          "fromPhase": "STOCKED",
          "toPhase": "DATA_READY",
          "at": "2026-08-19T06:27:40Z"
        },
        {
          "severity": "INFO",
          "code": "PHASE_TRANSITION",
          "fromPhase": "DATA_READY",
          "toPhase": "IMAGE_PENDING",
          "at": "2026-08-19T06:27:40Z"
        }
      ]
    }
  ],
  "pagesDeploymentRunId": null,
  "pagesDeploymentUrl": null,
  "displayVerifiedAt": null,
  "publicationSetAtEnd": null,
  "recovery": null,
  "auditSummary": null
}
