{
  "schemaVersion": 1,
  "runVersion": 1,
  "runId": "content-production-start-32240921338",
  "mode": "new-publication",
  "publicationPolicy": "cultivar",
  "status": "ACTIVE",
  "startedAt": "2026-08-19T10:05:33Z",
  "updatedAt": "2026-08-19T10:05:33Z",
  "finishedAt": null,
  "cancelledAt": null,
  "baseSha": "dce83952790c6374a20d95b8ecd4e290a78248f5",
  "currentBaseSha": "dce83952790c6374a20d95b8ecd4e290a78248f5",
  "attempt": 1,
  "previousAttempts": [],
  "mainHeadAtStart": "67d1be91db6aba8051eb28f3af4ad03f139e5e6e",
  "mainHeadAtEnd": null,
  "publishedIdsAtStart": [
    "bangi-haze",
    "bubba-kush-s1",
    "bubble-gum",
    "california-octane",
    "cataract-kush",
    "chocolope-256",
    "dr-grinspoon",
    "durban-poison",
    "frisian-duck",
    "gorilla-glue-4-s1",
    "jager-s1",
    "kali-mist",
    "malawi",
    "og-kush",
    "panama",
    "shaman",
    "strawberry-banana-s1",
    "super-lemon-haze",
    "the-og-18",
    "warlock",
    "wedding-cake",
    "wedding-cake-s1",
    "zamaldelica"
  ],
  "targetStrainIds": [
    "apple-fritter-s1",
    "chemdog-1-s1",
    "chemdog-4-s1",
    "granddaddy-purple-s1",
    "hp13-s1"
  ],
  "expectedPublicationDelta": [
    "apple-fritter-s1",
    "chemdog-1-s1",
    "chemdog-4-s1",
    "granddaddy-purple-s1",
    "hp13-s1"
  ],
  "items": [
    {
      "strainId": "apple-fritter-s1",
      "sourceStockPath": "stock/items/apple-fritter-s1.json",
      "sourceStockBlobSha": "42c2e90af891306644d6983cfa106e9e0c0fc06f",
      "productionStrainPath": "strains/apple-fritter-s1/strain.json",
      "publicationEntryId": "apple-fritter-s1",
      "productionPhase": "IMAGE_PENDING",
      "previousStablePhase": "IMAGE_PENDING",
      "manifestId": "content-production-start-32240921338-apple-fritter-s1-image",
      "manifestRevision": 1,
      "promotedAt": "2026-08-19T10:05:33Z",
      "promotionCommit": null,
      "approval": null,
      "commits": {
        "dataCommit": null,
        "imageInboxCommit": null,
        "imageProcessingCommit": null,
        "visualsCommit": null,
        "publicationCommit": null,
        "buildCommit": null
      },
      "audit": [
        {
          "severity": "INFO",
          "code": "PHASE_TRANSITION",
          "fromPhase": "STOCKED",
          "toPhase": "DATA_READY",
          "at": "2026-08-19T10:05:33Z"
        },
        {
          "severity": "INFO",
          "code": "PHASE_TRANSITION",
          "fromPhase": "DATA_READY",
          "toPhase": "IMAGE_PENDING",
          "at": "2026-08-19T10:05:33Z"
        }
      ]
    },
    {
      "strainId": "chemdog-1-s1",
      "sourceStockPath": "stock/items/chemdog-1-s1.json",
      "sourceStockBlobSha": "a3718c501b8b14478fda612950243b3c034c0c69",
      "productionStrainPath": "strains/chemdog-1-s1/strain.json",
      "publicationEntryId": "chemdog-1-s1",
      "productionPhase": "IMAGE_PENDING",
      "previousStablePhase": "IMAGE_PENDING",
      "manifestId": "content-production-start-32240921338-chemdog-1-s1-image",
      "manifestRevision": 1,
      "promotedAt": "2026-08-19T10:05:33Z",
      "promotionCommit": null,
      "approval": null,
      "commits": {
        "dataCommit": null,
        "imageInboxCommit": null,
        "imageProcessingCommit": null,
        "visualsCommit": null,
        "publicationCommit": null,
        "buildCommit": null
      },
      "audit": [
        {
          "severity": "INFO",
          "code": "PHASE_TRANSITION",
          "fromPhase": "STOCKED",
          "toPhase": "DATA_READY",
          "at": "2026-08-19T10:05:33Z"
        },
        {
          "severity": "INFO",
          "code": "PHASE_TRANSITION",
          "fromPhase": "DATA_READY",
          "toPhase": "IMAGE_PENDING",
          "at": "2026-08-19T10:05:33Z"
        }
      ]
    },
    {
      "strainId": "chemdog-4-s1",
      "sourceStockPath": "stock/items/chemdog-4-s1.json",
      "sourceStockBlobSha": "07d54ba4608aea30d470abb94fdb9f5e320b2f3a",
      "productionStrainPath": "strains/chemdog-4-s1/strain.json",
      "publicationEntryId": "chemdog-4-s1",
      "productionPhase": "IMAGE_PENDING",
      "previousStablePhase": "IMAGE_PENDING",
      "manifestId": "content-production-start-32240921338-chemdog-4-s1-image",
      "manifestRevision": 1,
      "promotedAt": "2026-08-19T10:05:33Z",
      "promotionCommit": null,
      "approval": null,
      "commits": {
        "dataCommit": null,
        "imageInboxCommit": null,
        "imageProcessingCommit": null,
        "visualsCommit": null,
        "publicationCommit": null,
        "buildCommit": null
      },
      "audit": [
        {
          "severity": "INFO",
          "code": "PHASE_TRANSITION",
          "fromPhase": "STOCKED",
          "toPhase": "DATA_READY",
          "at": "2026-08-19T10:05:33Z"
        },
        {
          "severity": "INFO",
          "code": "PHASE_TRANSITION",
          "fromPhase": "DATA_READY",
          "toPhase": "IMAGE_PENDING",
          "at": "2026-08-19T10:05:33Z"
        }
      ]
    },
    {
      "strainId": "granddaddy-purple-s1",
      "sourceStockPath": "stock/items/granddaddy-purple-s1.json",
      "sourceStockBlobSha": "5ad0f160361a8060389f2db44522188c07d45461",
      "productionStrainPath": "strains/granddaddy-purple-s1/strain.json",
      "publicationEntryId": "granddaddy-purple-s1",
      "productionPhase": "IMAGE_PENDING",
      "previousStablePhase": "IMAGE_PENDING",
      "manifestId": "content-production-start-32240921338-granddaddy-purple-s1-image",
      "manifestRevision": 1,
      "promotedAt": "2026-08-19T10:05:33Z",
      "promotionCommit": null,
      "approval": null,
      "commits": {
        "dataCommit": null,
        "imageInboxCommit": null,
        "imageProcessingCommit": null,
        "visualsCommit": null,
        "publicationCommit": null,
        "buildCommit": null
      },
      "audit": [
        {
          "severity": "INFO",
          "code": "PHASE_TRANSITION",
          "fromPhase": "STOCKED",
          "toPhase": "DATA_READY",
          "at": "2026-08-19T10:05:33Z"
        },
        {
          "severity": "INFO",
          "code": "PHASE_TRANSITION",
          "fromPhase": "DATA_READY",
          "toPhase": "IMAGE_PENDING",
          "at": "2026-08-19T10:05:33Z"
        }
      ]
    },
    {
      "strainId": "hp13-s1",
      "sourceStockPath": "stock/items/hp13-s1.json",
      "sourceStockBlobSha": "a76fa3afad7a7340cbc6208e5a200791eec1b438",
      "productionStrainPath": "strains/hp13-s1/strain.json",
      "publicationEntryId": "hp13-s1",
      "productionPhase": "IMAGE_PENDING",
      "previousStablePhase": "IMAGE_PENDING",
      "manifestId": "content-production-start-32240921338-hp13-s1-image",
      "manifestRevision": 1,
      "promotedAt": "2026-08-19T10:05:33Z",
      "promotionCommit": null,
      "approval": null,
      "commits": {
        "dataCommit": null,
        "imageInboxCommit": null,
        "imageProcessingCommit": null,
        "visualsCommit": null,
        "publicationCommit": null,
        "buildCommit": null
      },
      "audit": [
        {
          "severity": "INFO",
          "code": "PHASE_TRANSITION",
          "fromPhase": "STOCKED",
          "toPhase": "DATA_READY",
          "at": "2026-08-19T10:05:33Z"
        },
        {
          "severity": "INFO",
          "code": "PHASE_TRANSITION",
          "fromPhase": "DATA_READY",
          "toPhase": "IMAGE_PENDING",
          "at": "2026-08-19T10:05:33Z"
        }
      ]
    }
  ],
  "pagesDeploymentRunId": null,
  "pagesDeploymentUrl": null,
  "displayVerifiedAt": null,
  "publicationSetAtEnd": null,
  "recovery": null,
  "auditSummary": null
}
